{
  "contractVersion": "1.0",
  "calculationId": "calc-properties-001",
  "conditions": {
    "temperatureK": 310,
    "pressurePa": 100000
  },
  "system": {
    "mode": "CLOSED",
    "elementAmountsMol": {
      "H": 2,
      "O": 1
    }
  },
  "chemicalSystemRef": {
    "id": "demo-water-system",
    "versionId": "v1"
  },
  "thermodynamicDataRef": {
    "id": "demo-data",
    "versionId": "v1"
  },
  "requirements": [
    {
      "code": "GIBBS_ENERGY",
      "scope": "SYSTEM"
    },
    {
      "code": "GIBBS_ENERGY",
      "scope": "PHASE"
    },
    {
      "code": "ACTIVITY",
      "scope": "SPECIES"
    },
    {
      "code": "ACTIVITY_COEFFICIENT",
      "scope": "SPECIES"
    },
    {
      "code": "CHEMICAL_POTENTIAL",
      "scope": "SPECIES"
    }
  ],
  "solverOptions": {
    "maxIterations": 1000,
    "balanceAbsoluteToleranceMol": 1e-08,
    "balanceRelativeTolerance": 1e-08
  }
}
